headlines,description,content,url,category
Australian Open 2024: Can in-form Jannik Sinner clutch up for ultimate Novak Djokovic test?,The 22-year-old Italian continued his flawless tournament with a straight-sets win over Andrey Rublev in the quarterfinal,"Among the many storylines surrounding the Australian Open this year, it has relatively slipped under the radar that Jannik Sinner, the 22-year-old World No. 4 from Italy, is the most in-form player in the world.
His 6-4, 7-6 (5), 6-3 win over the fifth-seeded Russian Andrey Rublev on Tuesday was his 18th victory in the last 19 matches, which has included a talismanic Davis Cup win for his country. He has stormed through this tournament’s draw without dropping a set, and suffering only two breaks of serve.",https://indianexpress.com/article/sports/tennis/australian-open-2024-can-in-form-jannik-sinner-clutch-up-for-ultimate-novak-djokovic-test-9124542/,sports
"IND vs ENG: ‘No ultra-attacking, our batsmen are attacking by nature,’ says Rahul Dravid on Bazball","While India may not adopt an ultra-aggressive approach, their bowlers will definitely be tested by one from England.","Ahead of Test series it is quite common to hear about coaches speaking about batting approaches. Some demand them to show intent. Some back their players to go aggressive. There are instances where they are told to be bold. And then there is the entire Bazball approach, which has even managed to find a place in Collins dictionary. As India are set to embrace the Bazball challenge at home starting Thursday, India head coach Rahul Dravid’s message to the batting group was rather simple: play to the situation.
Ever since Bazball took Test cricket by storm, other teams have been faced with this question as to whether they would be tempted to adopt the same approach. With India set to roll out turners — where invariably a ball with your name on it could arrive any moment – adopting an aggressive approach with the bat has helped batsmen get out of jail. In fact, last time England visited India, Rohit Sharma’s century in the first innings at Chennai (second Test) proved to be a game-changer.",https://indianexpress.com/article/sports/cricket/ind-vs-eng-no-ultra-attacking-our-batsmen-are-attacking-by-nature-says-rahul-dravid-on-bazball-9124487/,sports
"Monty Panesar explains how tall offspinner Shoaib Bashir, Axar-clone Tom Hartley, attacking Rehan Ahmed fit into England’s Bazball tactics","With just one Test match under their belt, Bashir, Hartley and Ahmed arrive in India to partner Jack Leach with Bazball's initiation to spin bowling","One. That’s the grand total of Test matches Rehan Ahmed, Shoaib Bashir and Tom Hartley have played between each other. The first class outings of the trio doesn’t even add up to 40. And yet, it is them that England have entrusted – alongside Jack Leach – for the most daunting challenge in all of bilateral cricket – a Test series in India. This, against a team which has Ravichandran Ashwin, Ravindra Jadeja, and Axar Patel in attendance.
Former England spinner Monty Panesar, who played a crucial hand with 17 wickets in England’s triumphant Test series in India in 2012, reckons playing in these conditions may also be the greatest advantage for the novice spinners. And that it would fit in with the Bazball plan.
You have exhausted your monthly limit of free stories.
Register to read more stories
Continue With:-
Google
Facebook
Email
Already have an account? Sign in",https://indianexpress.com/article/sports/cricket/monty-panesar-explains-how-tall-offspinner-shoaib-bashir-axar-clone-tom-hartley-attacking-rehan-ahmed-fit-into-englands-bazball-tactics-9124332/,sports
IND vs ENG: Why KS Bharat fits the bill as wicketkeeper for England Test series at home,"Fast and safe hands, agility and experience of keeping in Tests at home makes him the ideal specialist for the five-match Test series against England","In 2019, more than a year after Rishabh Pant made his debut, as South Africa came visiting, India sprung a surprise. At Visakhapatnam, they drafted in another wicketkeeper Wriddhiman Saha ahead of Pant. Saha hadn’t played a Test for 20 months. On turning pitches, where the ball can do all sorts of tricks, they valued the primary skills of Saha over what Pant offered with the bat. With their spinners capable of creating plenty of chances they didn’t want any of them to go begging.
And five years later, despite a new team management and captain in place, in the pearl city of Hyderabad, India are fully valuing the gem of a wicketkeeper they have in KS Bharat.",https://indianexpress.com/article/sports/cricket/ind-vs-eng-why-ks-bharat-fits-the-bill-as-wicketkeeper-for-england-test-series-at-home-9124188/,sports
"Rohit leads ICC ODI Team of the Year, Ashwin and Jadeja in Test XI, Surya, Jaiswal, Bishnoi and Arshdeep make the cut in T20I XI","All-rounder Ravindra Jadeja and off-spinner Ravichandran Ashwin were the two Indians featuring in the Test Team of the Year, with Australia's WTC and ODI World Cup-winning captain Pat Cummins as its captain.","Although India lost the ODI World Cup final against Australia but they have dominated the ICC ODI Team of the Year, which is captained by Rohit Sharma. The team also featured five other Indians including Virat Kohli, Shubman Gill pace duo of Mohammed Shami and Mohammed Siraj and chinaman Kuldeep Yadav.
Rohit Sharma has scored 1,255 runs at an average of 52 last year. Shubman Gill has struck a brilliant 208 against the Kiwis and also finished as the highest run-scorer (1,584) in the format. Kohli finished as the second-highest run-scorer of the year in ODIs (1,337) and slammed six centuries during the year. He surpassed Sachin Tendulkar’s record of most international tons, besides winning the Player of the Tournament award during the World Cup.
You have exhausted your monthly limit of free stories.
Register to read more stories
Continue With:-
Google
Facebook
Email
Already have an account? Sign in",https://indianexpress.com/article/sports/cricket/rohit-leads-icc-odi-team-of-the-year-ashwin-and-jadeja-in-test-xi-surya-jaiswal-bishnoi-and-arshdeep-make-the-cut-in-t20i-xi-9123755/,sports
"Rahul Dravid defends Shubman Gill’s poor form in Tests, clarifies KL Rahul’s role and gives his verdict on Hyderabad pitch",Team India head coach Rahul Dravid says the pitch will definitely turn from Day 1 and Kohli's absence is a big opportunity for somebody else to step up.,"Rahul Dravid defended Shubman Gill’s struggle in the Test cricket, made it clear that KL Rahul won’t be playing as a wicketkeeper and the pitch at the Uppal Stadium in Hyderabad will turn from Day 1.
Gill, 24, who has been in great touch in the white-ball has failed to convert his form in the Test cricket. Since moving down to the No 3 position in West Indies, he has only managed 103 runs in six innings.
You have exhausted your monthly limit of free stories.
Register to read more stories
Continue With:-
Google
Facebook
Email
Already have an account? Sign in",https://indianexpress.com/article/sports/cricket/rahul-dravid-defends-shubman-gills-poor-form-in-tests-clarifies-kl-rahuls-role-and-gives-his-verdict-on-hyderabad-pitch-9123684/,sports
‘Only ‘Maxy’ can answer that one’: Pat Cummins hits out at Glenn Maxwell following another ‘alcohol-related incident’,"Cricket Australia have said that they are investigating an ""incident"" involving Glenn Maxwell in Adelaide after the all-rounder was taken to the hospital in an ambulance on January 19 night after he fell and lost consciousness.","Australia Test and ODI captain Pat Cummins didn’t minced his words on Glenn Maxwell, following “alcohol-related incident” for which the all-rounder was taken to the hospital in an ambulance on January 19 night after he fell and lost consciousness.
“Potentially, I think only ‘Maxy’ can answer that one,” Cummins told reporters.",https://indianexpress.com/article/sports/cricket/only-maxy-can-answer-that-one-pat-cummins-hits-out-at-glenn-maxwell-following-another-alcohol-related-incident-9123297/,sports
"India vs Syria Live Streaming, AFC Asian Cup 2023: When and where to watch match live","AFC Asian Cup Live Streaming, India vs Syria Football Match: India currently stand at the bottom of Group B, having lost their first two matches against Australia (0-2) and Uzbekistan (0-3).","India vs Syria AFC Asia Cup Live Streaming Details: India will take on Syria in a do-or-die match in their last game of Group B at the AFC Asian Cup. India currently stand at the bottom of Group B, having lost their first two matches against Australia (0-2) and Uzbekistan (0-3).
The four best third-placed teams from six groups, along with the top two teams from each group, will make it to the round of 16. For India, the equation is that they must get three points against Syria to secure the third spot and hope for the results in the other groups to go in their favour.
You have exhausted your monthly limit of free stories.
Register to read more stories
Continue With:-
Google
Facebook
Email
Already have an account? Sign in",https://indianexpress.com/article/sports/football/india-vs-syria-livestreaming-afc-asian-cup-2024-details-9123188/,sports
Rinku Singh added to India A squad for 2nd four-day match against England Lions,The second four-day match between India and England Lions will be played from Wednesday in Ahmedabad.,"A day after playing his Ranji Trophy match for Uttar Pradesh, southpaw Rinku Singh has been added to India A squad which will play their second four-day match against England Lions, starting from Wednesday. Earlier Rinku was in the India A squad for the third four-day game against Lions.
“The Men’s Selection Committee has added Rinku Singh to India ‘A’ squad for the second four-day match against England Lions to be played in Ahmedabad from January 24,” the board said in a release.",https://indianexpress.com/article/sports/cricket/rinku-singh-added-to-india-a-squad-for-2nd-four-day-match-against-england-lions-9122925/,sports
‘Australia Day’ row heats up after Cricket Australia bans the words ahead of 2nd Test vs West Indies at Gabba,"Australia Test captain Pat Cummins says there should be a better date to hold the celebrations, while Cricket Australia chief executive Nick Hockley agreed January 26 was ""a great national holiday"" but he wanted to ensure everyone felt welcome.","Australia Test captain Pat Cummins has backed Cricket Australia chief executive Nick Hockley saying January 26 is the wrong date to celebrate “Australia Day” and requested the government to choose a “better date.”
“My personal opinion is I absolutely love Australia. I think it’s the best country in the world by a mile and I think we should have an Australia Day but I think we can probably find a more appropriate day to celebrate it,” he told reporters.",https://indianexpress.com/article/sports/cricket/australia-day-row-heats-up-after-cricket-australia-bans-the-words-ahead-of-2nd-test-vs-west-indies-at-gabba-9122901/,sports
"Australian Open 2024: Zheng Qinwen and the steady, understated rise of Chinese tennis","China has overhauled the tennis system at home and results are showing; Eight players, seven women and one man, are currently in the top 100. Nine Chinese players were in the singles main draw of the Australian Open this year.","Following her 6-0, 6-3 win over France’s Oceane Dodin in the fourth round of the Australian Open on Monday, Zheng Qinwen has emerged, in terms of both ranking and form, as the front-runner to reach the final in Melbourne this week.
The lopsided top section of the draw, which has seen all the top seeds bow out early, has opened up an unlikely opportunity for the 21-year-old World No.15, who has a big serve, topspin-laden groundstrokes, and aggressive playing style, to become the first Chinese player since Li Na to reach the latter stages of a singles Major.",https://indianexpress.com/article/sports/tennis/australian-open-2024-zheng-qinwen-and-the-steady-understated-rise-of-chinese-tennis-9122605/,sports
"AFC Asian Cup: Goalless and pointless, India eye big improvement against Syria and helpful results elsewhere to boost R16 hopes","Despite their two matches ending in defeat, India can still qualify for the Round of 16 at AFC Asian Cup. Here's how:","If in Australia and Uzbekistan, India found top Asian teams looking to win the biggest football prize in the continent, against Syria, they find kinship in goals moving forward, even though both teams have found goals hard to come by. While Syria have a point from two games thanks to a 0-0 draw against Uzbekistan and can go through to the Round of 16 with a win against India, it’s a lot tougher for Igor Stimac’s team, who have conceded five goals over two games and not scored a single one of their own.
The top two teams from each of the six groups go through. With these 12 teams, four of the best third-placed teams will comprise the Round of 16.",https://indianexpress.com/article/sports/football/afc-asian-cup-goalless-and-pointless-india-eye-big-improvement-against-syria-and-helpful-results-elsewhere-to-boost-r16-hopes-9122598/,sports
IND vs ENG: India enter Bazball Universe with concerns about efficacy of turning tracks,"As the Bazball lands in India, with the first Test set to begin on Thursday in Hyderabad, all things point out to why the series could be the most challenging one for India.","It has been nearly 12 years since India lost a Test series at home. Since Alastair Cook’s England rallied to defeat them 2-1 in a four-match series, India have won 16 on the bounce – a feat that not even the all-conquering West Indies and Australia sides of the past – could come close. For 12 years, with a core of their XI remaining intact, they have looked truly invincible, having lost only three Tests at home. Beginning with Michael Clarke in 2013 to Pat Cummins in 2023, 14 captains have made attempts to win a series here. And among them only Steve Smith, Joe Root and Cummins have at least managed to win a Test here.
As the Bazball lands in India, with the first Test set to begin on Thursday in Hyderabad, all things point out to why the series could be the most challenging one for India. Like in 2012, when Andy Flower and Cook masterminded a sensational series win, defeating the hosts in their own game, India are a team in transition. And for the first two Tests in Hyderabad and Visakhapatnam, they will also be without Virat Kohli, meaning they will have the combined experience of their No 3, 4, 5, 6 will be only 86 Tests. And making it the most complicated for them is the Bazball approach from England, which is making them ponder over a lot.
While India have mostly preferred to play on turners since the World Test Championship came into picture, ahead of the England series there is an element of doubt if they stick to the same formula. Under Ben Stokes and Brendon McCullum, England have binned all conventions associated with Test cricket. The concept of following something just because it has been the norm before doesn’t exist in the Bazball universe.
Despite breaking barriers, there are already questions flying from all directions in the Old Blighty if England are stretching it too far. For a series of this significance, they landed in India only on Sunday night and have just three training sessions before they take the field in Hyderabad. In Bazball universe, all the preparations for a gruelling India tour happened at Abu Dhabi from mid-January.
There is a rationale, not just bravado behind it. They feared that India might serve batting tracks with a second-string attack against them in practice games. And even if there was a turning track, it’s said that they feared the scenario where batsmen get out cheaply without facing many balls and are mopping around on the field without much practice. Instead, in Abu Dhabi, they have gone about training on custom-made tracks, working on a batting routine they hope to adopt in the Tests.
Plenty of questions for India
In the 24 matches since McCullum took over and has redefined how England play Test cricket, they have an overall strike-rate of 75.48 with the bat. In the same period, India’s is 54.57 and Australia 54.14.
This approach, where England’s batting unit never takes the pedal off, has put opposition bowlers off guard. The noise and buzz around it only adds to their aura. From having just one win out of 17 before McCullum and Stokes took charge, they have now won 13 in the next 18, including three in Pakistan and one in New Zealand. So this isn’t confined to home. Of course, the upcoming five in India will be a stern test, especially in conditions where the Bazball is yet to be tested.
ADVERTISEMENT
And it is this unknown element that is making India fret a bit. They are blinded as to what to expect and are huddled in conversations. All things point to India playing on a turner in Hyderabad, but it is understood that this could well turn into a series where the hosts will take stock match after match. While India will heavily rely on the spin trio of R Ashwin, Ravindra Jadeja and Axar Patel, unlike the past there are deliberations if playing on turners could close the gap between the two sides, especially given India’s brittle middle-order.
On turning pitches, apart from toss becoming a crucial factor, it is one quick-fire innings from a batsman that has proved to be a big difference. It is the approach that even India’s batsmen are known to take on such conditions before they rely on the trio of spinners to do their job with the bat. However, with this high-risk game being England’s bread and butter, with their No 1 to No 11 following it to the T, there is more reason to be fearful of this approach as the game could unravel far more quickly than India have experienced at home.
  View this post on Instagram
  A post shared by We Are England Cricket (@englandcricket)
//www.instagram.com/embed.js
With all the venues having black soil pitches, for now India believe the lack of bounce and pace off the pitch could keep England’s batting in check. Such tracks where the batting unit have to force the pace could also unsettle England’s plans of playing taller batsmen – long reach against spinners – to an extent.
There were even deliberations whether India should go back to their traditional flat decks, which they used to great success during the 2016/17 season where they defeated New Zealand, England and Australia. But even that comes with its own risk element, especially with Bazball. Apart from toss being a factor as batting last on a deteriorating surface could be quite risky, the Bazball has thrived especially in such conditions. Even back home in England, they have moved on from playing on green tracks, instead opting for flat decks that suit England’s stroke-makers.
ADVERTISEMENT
“I don’t really relate to the term Bazball,” Jasprit Bumrah would tell Guardian. “But they are playing successful cricket and the aggressive route of taking the opposition on, showing the world there’s another way to play Test cricket. As a bowler, what I think is that it keeps me in play. And if they’re going for it, playing so fast, they won’t tire me out, I could get heaps [of wickets]. I always think about how I can use things to my advantage. Kudos to them but, as a bowler, you’re in the game.” Well, that’s one way to look at it, but there are concerns for India.
That they are facing their biggest ever test in over a decade without their best batsman makes it all the more interesting. Of course, given the calibre of India’s spinners which also includes Kuldeep Yadav, there is still every reason to believe they can extend their unbeaten streak at home. That Australia managed to keep the Bazball in check until Nathan Lyon was around at the Ashes last year would make India all the more hopeful, provided their batting unit steps up without their best Test batsman.",https://indianexpress.com/article/sports/cricket/ind-vs-eng-india-enter-bazball-universe-with-concerns-about-efficacy-of-turning-tracks-9122553/,sports
‘Didn’t get a good response… it triggered the whole team’: Jasprit Bumrah opens up on incident with James Anderson,"In the Lord's Test in 2021, Bumrah had targetted Anderson with a barrage of bouncers, hitting the tailender on the helmet, ribcage and his left hand. He also bowled 4 no balls. That over lit a spark in the rest of the series.","With the Indian cricket team taking on England in a five-Test series starting later this week, Jasprit Bumrah has opened up on the infamous 10-ball over he bowled to James Anderson in the Lord’s Test in 2021, a moment that lit a spark for the rest of the series.
Besides bowling four no balls in the over, Bumrah had targetted Anderson with a barrage of bouncers, hitting the tailender on the helmet, ribcage and his left hand.",https://indianexpress.com/article/sports/cricket/didnt-get-a-good-response-it-triggered-the-whole-team-jasprit-bumrah-opens-up-on-incident-with-james-anderson-9122434/,sports
"Ranji Trophy: Fog, harsh winter playing spoilsport in North India",Veteran BCCI administrator Ratnakar Shetty says the board should implement the Sunil Gavaskar-led technical committee's recommendation given a decade ago and not host any First-Class matches in the northern part of the country from December 15 to January 15.,"The Hostel Ground in Jammu hosted two games in the ongoing Ranji Trophy. In eight days, only 107.3 overs were bowled due to poor visibility. In the second round game between Jammu and Kashmir and Delhi, only two overs of play were possible on the first three days.
Jammu and Kashmir is not the only home side suffering due to the fog that has affected visibility. In the first-round match between Haryana and Rajasthan at Lahli, only 42 overs were possible. At the Sector 16 Cricket Stadium in Chandigarh, only 159.3 overs were bowled in the first round game against Railways, while only 26 overs of play were possible in the third round match played between Chandigarh and Gujarat.
You have exhausted your monthly limit of free stories.
Register to read more stories
Continue With:-
Google
Facebook
Email
Already have an account? Sign in",https://indianexpress.com/article/sports/cricket/ranji-trophy-fog-harsh-winter-playing-spoilsport-in-north-india-9122293/,sports
Ravi Shastri to get BCCI’s lifetime achievement award on Tuesday,BCCI awards function to be held in Hyderabad on Tuesday — first since 2019; Winners of past four years will be given their awards,"Former India coach, ex-allrounder and current commentator Ravi Shastri will be bestowed with the lifetime-achievement award by the Board of Control for Cricket in India’s (BCCI) in Hyderabad on Tuesday. The BCCI will conduct its award ceremony for the first time since 2019, the initial delay being because of COVID.
Shastri, 61, has worn multiple hats during his illustrious career on and off the field. Shastri played 80 Tests and 150 ODIs for India and his international career span was from 1981 to 1992.",https://indianexpress.com/article/sports/cricket/ravi-shastri-to-get-bccis-lifetime-achievement-award-on-tuesday-9122150/,sports
Virat Kohli withdraws from first two Tests against England due to personal reasons,"Virat has spoken to captain Rohit Sharma, team management and selectors, BCCI has said in a statement.","With just two days left for the first of five home Tests against England, India received an unexpected blow when star batsman Virat Kohli pulled out of the first two games citing personal reasons.
“Virat Kohli has requested the BCCI to be withdrawn from the first two Tests of the upcoming Test series against England, citing personal reasons,” the Board of Control for Cricket in India (BCCI) said in a statement.",https://indianexpress.com/article/sports/cricket/virat-kohli-withdraws-from-first-two-tests-against-england-citing-personal-reasons-9121921/,sports
