headlines,description,content,url,category
"International Education Day 2024: Know why it is celebrated on Jan 24, theme this year","On January 24, UNESCO will organise a one-day online training for several thousand teachers from around the world on the deconstruction of hate speech.","International Day of Education 2024: The International Day of Education is annually celebrated on January 24. This year marks the sixth year of the celebration, under the theme ‘learning for lasting peace’.
The day will be celebrated with several events such as ‘High level dialogue on learning for lasting peace’ at UNHQ (New York), a festival on the lines of ‘Learning to take care of oneself, others and the planet’, and much more.
Why is it celebrated on January 24?
In 2018, January 24 was declared as the International Day of Education by a resolution that was passed by the United Nations General Assembly (UNGA) on December 3, 2018. Following this, the first International Day of Education was observed on January 24, 2019.
Read | International Education Day 2024: Indian students need to work on soft skills, say experts
Since then, January 24 is annually celebrated as the International Day of Education. The 2024 celebration is the sixth year of celebration.
Understanding this year’s theme
The theme of the 2024 celebrations is ‘learning for lasting peace’. The thought behind this theme has been explained by the UNESCO as: the world is seeing a surge of violent conflicts paralleled by an alarming rise of discrimination, racism, xenophobia, and hate speech. The impact of this violence transcends any boundary based on geography, gender, race, religion, politics, offline and online. An active commitment to peace is more urgent today than ever: Education is central to this endeavor, as underlined by the UNESCO Recommendation on Education for Peace, Human Rights and Sustainable Development. Learning for peace must be transformative, and help empower learners with the necessary knowledge, values, attitudes and skills and behaviours to become agents of peace in their communities.
“The accelerated spread of hate speech is a threat to all communities. Our best defense is education, which must be at the heart of any peace efforts. It is our collective duty to empower learners of all ages to deconstruct hate speech, and lay the foundations for inclusive, democratic and human-rights respecting societies. To succeed, we need to better train and support teachers who are on the front lines in overcoming this phenomenon,” Audrey Azoulay, UNESCO Director-General said.
Keeping this in mind, UNESCO is dedicating this year’s celebrations to the crucial role education and teachers play in countering hate speech, which has seen an increase in recent years due to the emergence of social media.
On January 24, UNESCO will organise a one-day online training for several thousand teachers from around the world on the deconstruction of hate speech, which will give them the tools to spot, tackle and prevent hate speech incidents.",https://indianexpress.com/article/education/international-education-day-2024-celebrated-on-january-24-theme-9121972/,education
"ICAI to sign MoU with CBSE, launches study material to teach financial independence","This study material has modules such as 'Fundamentals of financial planning', ''banking and credit', 'understanding financial statements', 'basics of taxation', 'investment planning' and 'retirement planning'.","The Institute of Chartered Accountants of India (ICAI) will soon be signing a Memorandum of Understanding (MoU) with the Central Board of Secondary Education (CBSE), Aniket S Talati, President, ICAI, on January 22, announced at a press conference here.
Talking about the collaboration with CBSE, Talati added that ICAI will sign an MoU with CBSE on February 8. Through this partnership, ICAI will provide career counselling in CBSE schools to make school students aware about the Chartered Accountancy course and the future job opportunities available after completing this professional course. ICAI will also develop some course content for CBSE-affiliated schools in form of modules and videos.
This announcement was made during ICAI’s  National Education Summit on Commerce & Accountancy (NES-CA), which is being held on January 22 and 23 in New Delhi.
During the inaugural session of NES-CA 2024, ICAI also launched study material “Aarambh: A Step Towards Financial Independence”, which has been launched to enable students to foster financial resilience and enhance their decision making ability. This study material has modules such as ‘Fundamentals of financial planning’, ”banking and credit’, ‘understanding financial statements’, ‘basics of taxation’, ‘investment planning’ and ‘retirement planning’.
ICAI will also sign MoUs with 11 universities during this two-day event. As a part of the collaboration, ICAI will extend support to universities and colleges in various aspects, including the development of Commerce syllabi, content development, online and recorded lectures, and faculty development programmes.
Meanwhile, Prof Deepak Kumar Srivastava appreciated the institute for playing “a crucial role in promoting financial transparency, accountability, and good governance”. He further stated that UGC is closely working with Higher Educational Institutes (HEIs) and recently issued the guidelines to formulate the premise for integrating skilling into higher education at all levels and for introducing short-term industry-relevant courses (certificate courses) in the Higher Educational Institutes (HEIs) to bridge the skill gap. “We need to prepare an ecosystem among accounting professionals who are equipped with multiple skills matching with the requirements of global job market,” he added.",https://indianexpress.com/article/education/icai-to-sign-mou-with-cbse-launches-study-material-to-teach-financial-independence-9121944/,education
Maximum stipend at Rs 1.35 lakh last year: Annual Internship Report,"Annual Internship Report: Among the shortlisted applicants, 33 per cent had a BTech, highlighting a strong inclination towards tech roles. Additionally, 23 per cent were recent graduates.","The maximum stipend in 2023 reached Rs 1.35 lakh per month, while the average stipend per month was Rs 8,000, as per a report by job and training platform Internshala. Business development and management took the lead, offering 44 per cent of all internships, followed by engineering and media at 20 per cent and 18 per cent respectively. And data science, the lowest, at one per cent, reveals the Annual Internship Report.
Top fields, offers made, PPOs
Analysing the top fields offering internships, the report revealed the trend reflects strong demand for profiles in sales, marketing, digital marketing, business development, customer support and operations.
Engineering provided technology-focused internships in programming, AutoCAD, civil, web and app development. The media sector contributed in diverse profiles including creative writing, journalism, videography, photography and PR.
Read | Ministry of Commerce offers internships to UG, PG students, research scholars
Design presented five per cent of internship opportunities, while education and volunteering each held three per cent and finance at two per cent.
Internships varied in duration, ranging from one week to six months, averaging 3.66 months.
The report also highlighted a 200% increase in internship opportunities for Indian students over the past five years. According to the report, 23% of internships offered pre-placement offers (PPOs) based on intern performance.
More tech roles, mode of internship
Among shortlisted applicants, 33 per cent pursued a Bachelor’s in Technology (BTech), highlighting a strong inclination towards tech roles. Additionally, 23 per cent were recent graduates, 22 per cent were third-year students, and 19% were fourth-year students.
ADVERTISEMENT
Virtual internships accounted for a substantial 48%, offering work-from-home flexibility, while 42% remained in-office internships.
Delhi NCR offered most internships, skills sought
Delhi-NCR held the lion’s share at 34 per cent internship openings, followed by Mumbai and Bangalore at 16 and 10% respectively. Pune offered five per cent of the internships and Hyderabad and Jaipur provided three per cent each. This distribution, the report added, indicates promising opportunities for aspiring students in these cities in 2024.
Examining hiring preferences, recruiters sought skills such as verbal/spoken English proficiency which was asked in 15 per cent of internships, MS Excel, social media marketing, and digital marketing were key requirements in four per cent internships each.
ADVERTISEMENT
Skills like SEO, creative writing, adobe photoshop, and MS Office were also a requirement for 3% internships each.
Internship certificates, letters of recommendation, flexible working hours, a five-day work week, informal dress codes, and complimentary snacks and beverages made internship opportunities not only professionally enriching but also personally rewarding for the candidates, the Internshala report added.",https://indianexpress.com/article/education/annual-internship-report-maximum-stipend-data-science-contributed-lowest-offers-9121674/,education
"CTET January 2024: 84% appear; digital marksheets, eligibility certificates through DigiLocker","CTET 2024: As many as 9,58,193 candidates registered for paper 1 and 17,35,333 had registered for paper 2. ","CTET 2024: The Central Board of Secondary Education (CBSE) held the CTET 2024 exam on January 21. Of the total 26,93,526 candidates registering for the CTET January 2024 exam, 84 per cent applicants appeared for the exam, a CBSE statement said.
CTET was conducted for two question papers. While question paper-1 ensured the eligibility of teachers for Classes 1 to 5, while paper-2 ensured the eligibility of teachers for Classes 6 to 8. Candidates fulfilling the prescribed qualification can appear in one or both the papers and choose any two languages out of 20 prescribed languages.
As many as 9,58,193 candidates registered for paper 1 and 17,35,333 had registered for paper 2. 
As per data shared by the CBSE, a total of 137 city coordinators (two city coordinators due to excess of examination centres in some cities, 3,418 centre superintendents, 4,021 observers and 662 CBSE officials and employees were deployed for the smooth and fair conduct of the CTET 2024 exam.
CBSE has also made arrangements to provide digital marksheets and eligibility certificates through DigiLocker. DigiLocker accounts of all the appeared candidates will be created and the account credentials will be communicated to the candidates on their mobile numbers registered with CBSE. Candidates will be able to download their digital mark sheet and eligibility certificate using the communicated credentials.
For security purposes, the marksheet and certificate have an encrypted QR code which can be scanned and verified using DigiLocker mobile app, CBSE added saying that the digitally signed mark sheet and eligibility certificate are legally valid as per the IT Act.",https://indianexpress.com/article/education/ctet-january-2024-84-percent-appear-digital-marksheets-eligibility-certificates-digilocker-9121367/,education
CLAT 2024 Result: College-wise third provisional allocation list out at consortiumofnlus.ac.in,CLAT 2024: Allotment has been made on the basis of merit cum preferences expressed by the candidates in their counselling form.,"CLAT 2024 Result: The Consortium of National Law Universities has released the CLAT 2024 third provisional allocation list. Candidates who appeared for CLAT 2024 can check the official website – consortiumofnlus.ac.in and access the Common Law Admission Test (CLAT) third provisional allocation list.
A third provisional allocation list has been released college-wise on the official website. Two different lists are released for the 5-year integrated law programme and LLM programme.
CLAT 2024 was conducted on December 3 and result was declared on December 10.
Read | CLAT 2024 Result: Check alternate options for law courses
Candidates allotted seats in the CLAT 2024 second allotment list will have the option to ‘freeze’, ‘float’, or ‘exit’ option. Students using the ‘freeze’ or ‘float’ option will have to submit a non-refundable application fee of Rs 20,000.
The provisional list has mention of all India rank in CLAT 2024, admit card number, vertical reservation and horizontal reservation in the merit list.
Allotment has been made on the basis of merit cum preferences expressed by the candidates in their counselling form. If any discrepancy in the allotment, candidates are advised to contact the CLAT office at email id: clatoffice@consortiumofnlus.ac.in, a statement on the CLAT 2024 second provisional allocation list said.",https://indianexpress.com/article/education/clat-2024-result-third-provisional-allocation-list-out-9121269/,education
"JEE Main v/s NEET UG: Check main differences in subject preparation, important chapters",Understanding the nuances and aligning study approaches with the specific exam requirements are crucial for aspirants aiming to excel in either of these competitive examinations.,"— Nabin Kaarki
The journey toward success in competitive exams like NEET (National Eligibility cum Entrance Test) and JEE (Joint Entrance Examination) is marked by rigorous preparation. Both exams — NEET for medical aspirants and JEE for engineering — demand meticulous planning and a structured approach. However, the strategies for subject-specific preparation in these exams have unique subtleties that are crucial for aspirants looking to succeed in these challenging tests.
Biology vs. Mathematics
NEET aspirants prioritise Biology, a substantial section of the exam (50 per cent), focusing on comprehensive understanding, memorisation, and interpretation of biological concepts, complemented by extensive reading of NCERT books. In contrast, JEE applicants delve deeply into mathematics, emphasising problem-solving skills and a profound understanding of complex mathematical concepts through various resources.
(Graphics by Abhishek Mitra)
Read | JEE Main 2024 Session 1 Exam Live Updates
Chemistry
The Chemistry syllabi of NEET and JEE share many similarities. However, JEE poses complex questions that are more computation-oriented.
NEET-specific preparation:
Commence with a meticulous study of the NCERT book, as questions often mirror its content.
Memorise formulas and equations, creating a formula chart for easy reference.
Regularly practise solving numerical problems.
JEE-specific preparation:
Prioritise understanding Physical Chemistry formulas and their applications.
Practise rapid calculations for answering physical chemistry questions, optimising time management during the exam.
Excel in Organic Chemistry by mastering name reactions and crucial equations, concentrating on understanding reaction mechanisms. 
(Graphics by Abhishek Mitra)
Read | JEE Main 2024: Check study plan for last week before exam
Physics
Although the Physics syllabi of NEET and JEE share  similarities, JEE questions, unlike NEET, often require multiple concepts in one question.
NEET-specific preparation:
Avoid consulting multiple books on a single topic, relying on trusted sources.
Mark crucial questions, particularly in Mechanics and Electromagnetism, for effective revision.
Grasp fundamental ideas and concepts before delving into formulas.
JEE-specific preparation:
ADVERTISEMENT
Develop conceptual clarity for solving numerical problems.
After solving problems in NCERT and HC Verma’s books, tackle more advanced problems in Irodov’s book.
Utilise diagrams to solve problems efficiently. Practise putting data on a diagram for analysis and step minimisation.
Develop analytical skills for problem-solving without relying on memorisation.
Exposure to Olympiad exams enhances readiness for JEE Advanced.
Read | NEET UG 2024: How to retain better, practice questions and learn NCERT?
(Graphics by Abhishek Mitra)
Variance of Materials
(Graphics by Abhishek Mitra)
While both NEET and JEE demand dedication, resilience, and a structured study approach, the key differences lie in the emphasis on specific subjects and the depth of knowledge required. NEET leans towards a more holistic understanding of concepts, focusing on memorisation and application, while JEE leans towards mathematical prowess, problem-solving, and an in-depth grasp of scientific principles.",https://indianexpress.com/article/education/jee-main-v-s-neet-ug-crucial-differences-in-subject-preparation-important-chapters-9111723/,education
"Dr Carol Folt at Idea Exchange: ‘One of the jobs of a president of a university is to hold the centre, so that all voices are heard’","Dr Carol Folt, president of University of Southern California (USC), is the first woman to hold this position.","President of University of Southern California (USC) Carol Folt on resolving issues at USC, enhancing diversity on campus and what it means for Indian students to be in American universities. The session was moderated by Ritika Chopra, Chief of the National Bureau (Govt) and National Education Editor, The Indian Express
Ritika Chopra: Firstly, what brings you to India.",https://indianexpress.com/article/education/dr-carol-folt-at-idea-exchange-one-of-the-jobs-of-a-president-of-a-university-is-to-hold-the-centre-so-that-all-voices-are-heard-9120970/,education
Study Abroad: Check top scholarships to pursue higher education in US,"Exposure to distinct customs, traditions, and languages goes beyond expanding personal horizons. It cultivates a global perspective, a much sought after skill in the overall paradigm of global interconnectedness and interrelatedness.","— Ashish Jha
Many prestigious universities worldwide offer specialised programmes and research opportunities that can significantly enrich a student’s academic journey. Access to global expertise, state-of-the-art facilities, innovative teaching methods etc. provide a win-win situation for career advancement for Indian students willing to pursue their studies abroad. There is no doubt that international education in the emerging context enhances employability, adaptability, resilience, and global awareness and at the same time it brings forth precious international experience that is valued by employers worldwide.
In a nutshell, international education opens the door to a wide range of enriching experiences, deeper understanding of global issues which are crucial skills for personal and professional growth.
Data released by the Ministry of External Affairs states that in 2022, more than 13 lakh Indian students were studying in 79 countries worldwide. The countries that have found favours among Indian students include the following:
United Kingdom
USA
Australia
Canada
Ireland
UAE
Germany
Many governments worldwide offer scholarships to international students, fostering diplomatic and educational ties. Some of the most popular and relevant opportunities for the benefit of our students planning their higher studies in the US are listed hereafter.
India and the United States
United States-India Educational Foundation (USIEF) offers academic guidance, fellowship support and facilitates academic dialogue between the U.S. and India. The USIEF since its inception has awarded around 20,000 Fulbright, Fulbright-Nehru, and other prestigious grants and scholarships in almost every academic domain. The Fulbright Program is now the largest educational scholarship program in the world and operates between the US and more than 150 countries. It not only works as an important forum for interfacing with the civil society but also offers collaboration through lectures and communication through e-enabled platforms.
India has been one of the largest recipients of the Fulbright Programs worldwide.
EducationUSA
ADVERTISEMENT
EducationUSA is the official source of information on US higher education. It is the United States Department of State network that promotes higher education in the US. It has over 430 international student advising centers located in more than 175 countries and territories. It provides most accurate, comprehensive, and current information on available opportunities.
Interested applicants can reach out to an EducationUSA advising center either in-person or virtually. They can engage with the centers through phone, email, WhatsApp, and other digital platforms. EducationUSA services in India are located at six centers across five cities viz. New Delhi (headquarters), Mumbai, Kolkata, Hyderabad, and Chennai. It is administered by the United States-India Educational Foundation (USIEF) – the Fulbright Commission in India.
Some of the other notable scholarships for students to study in USA include the following:
ADVERTISEMENT
Tata Scholarships for Cornell University: This scholarship is for undergraduate students from India who are accepted for admission to Cornell University and need financial support.
Inlaks Shivdasani Foundation Scholarships: Inlaks Scholarships Foundation focuses on providing scholarships, grants and awards in various fields for the development of professional, scientific, artistic and cultural abilities of young Indians, both abroad as well as in India.
AAUW International Fellowships: The American Association of University Women (AAUW) offers fellowships for women pursuing full-time graduate or postdoctoral study in the US. The programme provides support to women who are not US citizens or permanent residents.
Humphrey Fellowship Programme: This fellowship programme is meant for experienced professionals interested in strengthening their leadership skills through a mutual exchange of knowledge and understanding about issues of common concern in the US and their home countries.
Rotary Peace Fellowship: Rotary is a global network of 1.4 million neighbors, friends, leaders, and problem-solvers who see a world where people unite and take action. Each year, The Rotary Foundation awards up to 50 fellowships for master’s degrees and up to 80 for certificate studies at premier universities.
MITACS Globalink Research Internship: While not a direct scholarship, this program allows Indian students to undertake research internships at Canadian universities, including some collaborations with US institutions.
In conclusion, it must be acknowledged that timely, correct, and relevant information on available scholarship and fellowship opportunities serve as the gateways for navigating the world of study abroad scholarship meant for Indian students. It has the potential to transform aspirations of studying abroad into tangible realities without worrying about the financial implications. 
(The writer is the chief content strategist at Buddy4Study)",https://indianexpress.com/article/education/study-abroad/study-abroad-top-scholarships-us-universities-fullbright-cornell-9120154/,education
Delhi government to make hybrid learning plan for schools through DMVS,"'Have directed officials to build a plan towards achieving this goal of hybrid education, integrating DMVS with the physical schooling ecosystem,' Atishi posted.","Keeping in mind how school schedules have been disrupted due to bad weather and Covid in the last few years, the Delhi government, led by Arvind Kejriwal, has launched the Delhi Model Virtual School (DMVS).
“The Delhi Model Virtual School, under the Arvind Kejriwal Govt, realises our vision of providing quality education to every child, even beyond the last mile. Had the opportunity to visit the school and engage with our students during a virtual math class..,” Delhi Education Minister Atishi posted on her official ‘X’ account.
The ‘Delhi Model Virtual School’ is a unique experiment in ensuring world-class learning reaches even those who can't reach school.
DMVS will now be working towards making all Delhi Govt schools hybrid – where teaching-learning is available both offline and online. This will… pic.twitter.com/RwJ3rRskhm
— Atishi (@AtishiAAP) January 20, 2024
The aim of DMVS is to create a hybrid schooling model, so that student’s education does not get affected due to weather conditions. “Through cutting-edge studio & trained teachers, our virtual school conducts live classes & shares digital resources with its students,” she said.
DMVS will now be working towards making all Delhi government schools hybrid, i.e. teaching-learning will be available both offline and online. This will ensure that even if the government has to close schools due to weather uncertainties, children’s education remains unaffected.
Additionally, students of Delhi government schools can now prepare for JEE, NEET UG and CUET UG through this platform.",https://indianexpress.com/article/education/kejriwal-govt-delhi-model-virtual-school-dmvs-jee-neet-cuet-9120302/,education
