headlines,description,content,url,category
"Indian bourses now fourth-largest with combined stock value of $4.33 trillion, surpasses Hong Kong","The US, China and Japan are the top stock markets in the world. BSE’s market capitalisation was Rs 366 lakh crore on Tuesday.","Indian stock market surpassed Hong Kong to become the fourth largest equity market for the first time even as domestic indices fell 1.5 per cent on Tuesday.
The combined value of listed shares on Indian exchanges stood at $4.33 trillion on Monday compared to $4.29 trillion for Hong Kong, according to a Bloomberg report. The US, China and Japan are the top stock markets in the world. BSE’s market capitalisation was Rs 366 lakh crore on Tuesday.
You have exhausted your monthly limit of free stories.
Register to read more stories
Continue With:-
Google
Facebook
Email
Already have an account? Sign in",https://indianexpress.com/article/business/economy/indian-bourses-now-fourth-largest-with-combined-stock-value-of-4-33-trillion-surpasses-hong-kong-9124630/,business
"Centre’s sovereign AI push: Compute mission may get over Rs 10,000 crore outlay","“We will take the proposal for the AI Mission to the Cabinet soon. We are still working out some contours, but the overall outlay for the initiative could be more than Rs 10,000 crore,” he said.","The Centre’s ambitious artificial intelligence (AI) Mission may soon head for Cabinet approval and could have an outlay of more than Rs 10,000 crore, Union Minister of State for Electronics and IT Rajeev Chandrasekhar told reporters Tuesday.
As part of the programme, the government wants to develop its own ‘sovereign AI’, build computational capacity in the country, and offer compute-as-a-service to India’s startups.
This story is subscriber only!

Now subscribe at a special Republic Day offer of Rs 75/month.
Subscribe Now
Already a subscriber? Sign in",https://indianexpress.com/article/business/centres-sovereign-ai-push-compute-mission-may-get-over-rs-10000-crore-outlay-9124624/,business
"Direct tax-GDP ratio rose to 15-year high in FY23, tax buoyancy dipped","As per CBDT, a taxpayer is a person who either has filed a return of income for the relevant assessment year (AY) or in whose case tax has been deducted at source in the relevant financial year but the taxpayer has not filed the return of income.","Direct tax-to-GDP ratio, which reflects the share of taxes in the overall output generated in the country, rose to a 15-year high of 6.11 per cent in the financial year 2022-23, time-series data released by the Central Board of Direct Taxes (CBDT) under the Ministry of Finance showed Tuesday. This was accompanied by an increase in the income tax return filers in India to 7.4 crore in FY23, up 6.3 per cent from FY22, even as the tax buoyancy — the growth rate of taxes in relation to the economy’s nominal growth rate — declined to 1.18 in 2022-23 from 2.52 in 2021-22 and 1.29 in the pre-Covid year of 2018-19.
The cost of tax collection — indicating the expenditure on tax collection as a proportion of the total tax collections — inched lower to 0.51 per cent in FY23, the lowest level since 2000-01, but it increased in absolute terms to Rs 8,452 crore, the highest level since 2000-01, the year for which data is last available, the CBDT data showed.
You have exhausted your monthly limit of free stories.
Register to read more stories
Continue With:-
Google
Facebook
Email
Already have an account? Sign in",https://indianexpress.com/article/business/economy/direct-tax-gdp-ratio-rose-to-15-year-high-in-fy23-tax-buoyancy-dipped-9124628/,business
Groww glitch: Clients demand compensation as trading platform faces outage,"Acknowledging the complaints, the financial service platform later informed about a technical glitch amid calls for refunds.","Popular trading platform Groww faced heat from its clients during the early trading hours on Tuesday, as users complained about encountering login problems through the company’s app and website. The users took to social media to complain about their plight of incurring losses. Most of the users complained of receiving the message “Oops! Something went wrong”.
Acknowledging the complaints, the financial service platform later informed about a technical glitch amid calls for refunds. Around two hours into the trading session, the platform finally announced the resolution of the issue at 11.30 am. However, some users continued to complain about login failures, indicating that the platform is still not back to normal operations.
You have exhausted your monthly limit of free stories.
Register to read more stories
Continue With:-
Google
Facebook
Email
Already have an account? Sign in",https://indianexpress.com/article/business/groww-glitch-clients-compensation-trading-platform-outage-9124054/,business
ONGC gets Petroleum Ministry’s nod for green energy subsidiary,"The subsidiary company will engage in businesses related to green hydrogen, hydrogen blending, renewable energy solar, wind and hybrid etc., biofuels, biogas business and LNG.","The Petroleum and Natural Gas Ministry has approved the formation of a subsidiary company of Oil and Natural Gas Corporation Limited (ONGC) for green energy and gas business.
The company will engage in businesses related to green hydrogen, hydrogen blending, renewable energy solar, wind and hybrid etc., biofuels, biogas business and LNG.
This was informed in the ONGC’s board meeting on Tuesday.
ADVERTISEMENT
As per the outcome of the board meeting, the proposed name of the company is “ONGC Green Limited” which is subject to the approval of the Ministry of Corporate Affairs, government of India.
“In continuation of our filing dated 13.02.2021, it is hereby updated that the Company has received approval from the Ministry of Petroleum and Natural Gas (MoPNG) on 05.12.2023 for the formation of a wholly-owned subsidiary company,” the outcome of the meeting read.
“The wholly-owned subsidiary company shall be engaged into the business of value-chains of energy business viz. Green Hydrogen, Hydrogen blending, Renewable Energy (Solar, Wind and Hybrid etc.), Bio-fuels/ Bio-gas business and LNG,” it added.
During the meeting, the Board has also accorded its in-principle approval for the formation of a Joint Venture Company (JVC) with NTPC Green Energy Limited.
ADVERTISEMENT
The JVC shall be engaged in the business of Offshore Wind Energy and other Renewable Energy.
India committed to an ambitious five-part “Panchamrit” pledge at COP26 held in 2021. They included reaching 500 GW of non-fossil electricity capacity, generating half of all energy requirements from renewables, and reducing emissions by 1 billion tonnes by 2030.
India also aims to reduce the emissions intensity of GDP by 45 per cent. Finally, India commits to net-zero emissions by 2070.
ADVERTISEMENT
India, the world’s third-biggest oil importer and consumer, is dependent on crude oil from various sources in the global market to meet its domestic demand.
 ",https://indianexpress.com/article/business/companies/ongc-petroleum-ministry-nod-for-green-energy-subsidiary-biofuel-lng-9123926/,business
India’s sunflower imports to falter as Red Sea attacks lift freight costs,"The world's biggest sunflower oil buyer typically sources most of its imports from the Black Sea region via the Red Sea. However, recent Houthi attacks have compelled shipping companies to reroute trade between Europe and Asia around Africa, increasing time and costs.","India’s sunflower oil imports are set to decline in coming months as a rally in prices, driven by a surge in freight rates, is prompting buyers to shift to rival vegetable oils available at a discount, traders told Reuters.
The world’s biggest sunflower oil buyer typically sources most of its imports from the Black Sea region via the Red Sea. However, recent Houthi attacks have compelled shipping companies to reroute trade between Europe and Asia around Africa, increasing time and costs.
The elevated freight rates have lifted the landed cost of sunflower oil above that of soyoil in India for the first time in nearly a year, said Sandeep Bajoria, CEO of Sunvin Group, a vegetable oil brokerage.
ADVERTISEMENT
“Sunoil imports were robust in the last few months due to the price advantage it had over soyoil. However, it lost this advantage because of rising freight,” he said.
Crude sunflower oil imports are currently offered at about $943 a tonne, including cost, insurance and freight (CIF), in India for February delivery, while crude soyoil is offered at around $935 and crude palm oil at $933, dealers said.
Two months ago, sunflower oil was trading at a $120 per ton discount to soyoil, which encouraged Indian traders to increase sunoil imports.
In December, India’s sunoil imports more than doubled from a month earlier to 260,850 tons.
ADVERTISEMENT
Soyoil imports in December rose by 1.8% to 152,650 tons but remained significantly below the average imports of 306,000 tons in the marketing year that ended in October 2023.
In January, sunflower oil imports could fall to 225,000 tons as soyoil imports are likely to jump above 230,000 tons, said Rajesh Patel, managing partner at edible oil trader and broker GGN Research.
“In the coming months sunflower oil imports would go down to around 200,000 tons if the current price trend continues,” Patel said.
ADVERTISEMENT
India buys palm oil mainly from Indonesia, Malaysia and Thailand, while it imports soyoil and sunflower oil from Argentina, Brazil, Russia and Ukraine.
Argentina is currently offering sunoil at more competitive prices than supplies from Black Sea region countries, said a Mumbai-based dealer with a global trade house. Red Sea shipping disruptions would prompt India to buy more soyoil from South America and less sunoil from the Black Sea region, he said.
 ",https://indianexpress.com/article/business/commodities/india-sunoil-import-falter-as-red-sea-attacks-lift-freight-costs-houthi-palm-oil-9123759/,business
Union Budget 2024: Expectations from agriculture sector,It is expected that the agriculture budget for 2024-25 addresses multiple pain-points of the sector simultaneously.,"India’s growing population along with a constant rise in income levels is leading to a constant increase in demand for agricultural products and increasing burden on existing agricultural resources. The prevailing scenario indicates a need to improve productivity along with reducing costs and improving quality to make the most efficient use of the available resources. The growing adoption of cutting-edge agricultural techniques as well as incorporation of artificial intelligence (AI), geographic information systems (GIS), drones, and remote sensing-based technologies in agriculture is a step in the right direction.
Current challenges faced by the sector
Although the agriculture sector has transformed significantly over the last few decades, challenges like fragmented landholdings, low productivity, limited mechanization, minimal value addition opportunities and insufficient credit availability prevent farmers from realizing higher prices. Another major problem is inefficient extension mechanisms, which makes it difficult for advanced agricultural practices to reach each and every farmer. Due to this farmers still use basic, traditional methods for cultivation.
You have exhausted your monthly limit of free stories.
Register to read more stories
Continue With:-
Google
Facebook
Email
Already have an account? Sign in",https://indianexpress.com/article/business/budget/budget-2024-agriculture-sector-expectations-9123503/,business
Zee Entertainment shares plunge over 30% after Sony calls off merger,"Culver Max Entertainment, formerly known as Sony Pictures Networks India (SPNI), has terminated merger agreements with Zee Entertainment, which could have otherwise created a USD 10 billion media enterprise in the country. Zee's stock touched its lower price band on both BSE and NSE as the bourses revised lower circuit limit for the company on Tuesday.","Shares of Zee Entertainment Enterprises Ltd (ZEEL) tanked over 30 per cent on Tuesday, a day after Culver Max Entertainment (formerly Sony Pictures Networks India) called off its USD 10-billion merger with the Indian media group.
The stocks of ZEEL tumbled 32.61 per cent to trade at Rs 155.95 a piece on the NSE. On the BSE, the company’s shares nosedived 32.73 per cent to Rs 155.90 per piece. The stock touched its lower price band on both BSE and NSE as the bourses revised lower circuit limit for the company on Tuesday.
In the Tuesday’s session, the 30-share BSE Sensex declined 1,053.10 points or 1.47 per cent to trade at 70,370.55, while NSE Nifty fell 333 points to trade at 21,238.80.
ADVERTISEMENT
On Monday, Culver Max Entertainment, formerly known as Sony Pictures Networks India (SPNI), terminated merger agreements with Zee Entertainment, which could have otherwise created a USD 10 billion media enterprise in the country.
“SPNI, a wholly-owned subsidiary of Sony Group Corporation, today issued a notice terminating the definitive agreements entered into by SPNI and Zee Entertainment Enterprises Ltd (ZEEL) relating to the merger of ZEEL with and into SPNI, which was…announced on December 22, 2021,” a statement by Sony Group Corporation said on Monday.
Sony sent the termination notice to Subhash Chandra family-promoted media and entertainment firm following a stalemate over who will lead the merged entity, besides not satisfying other conditions for the merger.
Sony is also seeking USD 90 million as break-up fees for violating the terms of the merger pact and “invoking arbitration”, which ZEEL said it will contest legally. On the other hand ZEEL said it has spent Rs 366.59 crore on compliances till September 2023 for its merger with Sony.
ADVERTISEMENT
The company spent Rs 176.20 crore in the financial year that ended in March 2023. Besides, it spent Rs 190.39 crore in the first six months of the current fiscal, according to a regulatory filing by ZEEL.
On December 17 last year, ZEEL had sought an extension of the deadline from Culver Max and Bangla Entertainment Pvt Ltd (BEPL) under the 2021 agreement.
SPNI had initially said that it had not yet agreed to the deadline extension request by ZEEL. But later, it agreed to discuss the matter.
ADVERTISEMENT
The proposed USD 10-billion merger had already received regulatory approvals from fair trade regulator CCI, NSE and BSE, shareholders and creditors of the company. In August last year, the Mumbai bench of the National Company Law Tribunal (NCLT) also gave a go-ahead to the merger. 
 ",https://indianexpress.com/article/business/companies/zee-entertainment-share-price-stock-sony-calls-off-merger-9123170/,business
"Stock Market Today: Sensex, Nifty falls over 1% after erasing early trade gains","India's market cap soared to $4.33 trillion, establishing the country as the world's fourth largest stock market, replacing Hong Kong.","India’s benchmark indices BSE Sensex and Nifty50 ended Tuesday’s session in red with 1.47 per cent and 1.54 percent loss at 70,370.55 and 21,238.80 marks respectively.
The indices opened higher today following positive cues from global markets and strong Q3 earnings. BSE Sensex opened 444.55 points, or 0.62 per cent at 71,868.20 points with Nifty50 inching higher with 144.90 points, or 0.67 per cent at 21,716.70. The gains came even as the Indian stock market became the fourth-highest equity market with a combined value of listed shares standing at $4.33 trillion, as per Bloomberg, surpassing Hong Kong’s equity market whose combined value stood at $4.29 trillion on Monday.
You have exhausted your monthly limit of free stories.
Register to read more stories
Continue With:-
Google
Facebook
Email
Already have an account? Sign in",https://indianexpress.com/article/business/market/stock-market-today-sensex-nifty-gain-loss-oil-price-rupee-9123066/,business
Sony calls off $10-billion merger with Zee; seeks $90-million termination fee,"As per the original merger plan, Sony would have held 51 per cent stake in the entity and promoters’ share would have been 4 per cent while the rest would have been held by the public","Japan’s Sony Group Corporation has called off the proposed $10 billion merger of Zee Entertainment Enterprises Ltd (ZEEL) with Sony Pictures Networks India Private Ltd (now known as Culver Max Entertainment Ltd), a wholly-owned subsidiary of the Sony Group. Reacting to the Sony move, ZEEL said it will take steps, including appropriate legal action and contesting Culver Max and BEPL’s claims in the arbitration proceedings.
ZEEL said it received communications dated January 22 from Culver Max and Bangla Entertainment Pvt Ltd (BEPL) “purporting to terminate the merger co-operation agreement (MCA) and seeking termination fee of $ 90 million on account of alleged breaches by ZEEL of the terms of the MCA, and invoking arbitration against the company and seeking emergency interim reliefs against the company”.
You have exhausted your monthly limit of free stories.
Register to read more stories
Continue With:-
Google
Facebook
Email
Already have an account? Sign in",https://indianexpress.com/article/business/sony-calls-off-10-billion-merger-with-zee-seeks-90-million-termination-fee-9122714/,business
"No relook at duty remission scheme needed due to US, EU action: Official","The RoDTEP scheme, announced in January 2021, refunds embedded duties and taxes, such as VAT on fuel used in transportation, mandi tax and duty on electricity. It replaced the WTO-incompatible Merchandise Exports from India Scheme (MEIS) scheme, which had faced several challenges from WTO members.","The union government does not intend to relook at its Remission of Duties and Taxes on Exported Products (RoDTEP) scheme after the United States (US) and the European Union (EU) last year imposed countervailing duties on four Indian products citing breach of World Trade Organization (WTO) norms, a government official said.
The US and EU had imposed countervailing duties (CVDs) on paper file folders, common alloy aluminum sheet and forged steel fluid after an anti-subsidy investigation. CVDs are tariffs on imported goods that are imposed to offset subsidies given by the exporting country’s government, aimed at protecting the domestic industry.
You have exhausted your monthly limit of free stories.
Register to read more stories
Continue With:-
Google
Facebook
Email
Already have an account? Sign in",https://indianexpress.com/article/business/economy/no-relook-at-duty-remission-scheme-needed-due-to-us-eu-action-official-9122713/,business
Udaan announces senior-level changes; Group CFO Aditya Pande resigns,"Vishnu Menon, Head of Corporate Strategy and investor relations, will take on the additional responsibility of business finance, as part of the organisational changes.","udaan, an e-B2B (business-to-business) platform, on Monday announced senior-level organisational changes under which Group Finance Controller Kiran Thadimarri has been elevated to executive management team with additional responsibility of treasury, corporate finance and corporate audit.
The company informed that Aditya Pande has decided to pursue opportunities outside of udaan, after a successful stint of over three years as Group CFO.
Also, Vishnu Menon, Head of Corporate Strategy and investor relations, will take on the additional responsibility of business finance, as part of the organisational changes.
ADVERTISEMENT
The two executives — Menon and Thadimarri — will work towards further strengthening the financial and governance practices at udaan with the objective of enabling the company to achieve operational profitability and public market readiness in the next 12-18 months, according to a company release.
Announcing the organisational changes, udaan said these are in line with the company’s commitment to drive profitable growth and continue strengthening core capabilities.
As part of the organisational changes, Kiran Thadimarri, Group Finance Controller, will be elevated to be a part of the executive management team with additional responsibility of handling treasury operations, corporate finance and corporate audit, in addition to his existing responsibility of financial controller.
In his enhanced role, Thadimarri will report to the CEO.
ADVERTISEMENT
The release mentioned that Thadimarri, a qualified Chartered Accountant, has been associated with udaan for close to three years.
In a career spanning two decades, Kiran graduated from GE’s premier leadership programmes, was CFO of GE Water, South Asia, has worked closely with Aditya Pande (outgoing Group CFO, udaan) at GE Healthcare during his 14-year stint at GE, and subsequently co-founded a healthcare technology distribution company.
Vishnu Menon, Head – Corporate Strategy & IR, takes on the additional responsibility of business finance, and will continue to report to the CEO.
ADVERTISEMENT
Menon has been associated with udaan for the past four years. An MBA from IIM Calcutta with a degree in Engineering from the Kerala University, Menon in the past has worked as a management consultant with Bain & Co and was also the Founder & CEO of Wandertrails, an experiential travel startup.
Informing about Aditya Pande’s exit, after a successful stint of over three years as Group CFO, the company said as he transitions, the solid foundation laid during his tenure will enable udaan to tap future growth opportunities, capitalise on scale, and leverage cost synergies.
“During his tenure, Aditya played a pivotal role in shaping udaan’s financial strategy marked by strategic financial decision-making, implementation of resilient financial systems, successful fund raising and a razor-sharp focus on fiscal management,” the release said.",https://indianexpress.com/article/business/udaan-senior-level-changes-group-cfo-aditya-pande-resigns-9122342/,business
IPO Launch this week: Nova Agritech among six to hit markets,"List of upcoming IPOs for this week includes Nova Agritech, Fonebox Retail, DelaPlex Limited, Megatherm Induction, Harshdeep Hortico and Brisk Technovision.","After witnessing seven Initial Public Offering (IPOs) during last week, India’s primary markets are all set to hit by six new IPOs this week. This includes one mainboard IPO and five offerings of Small-Medium Enterprises (SME).
List of upcoming IPOs for this week includes agritech giant Nova Agritech followed by Fonebox Retail, DelaPlex Limited, Megatherm Induction, Harshdeep Hortico and Brisk Technovision.
You have exhausted your monthly limit of free stories.
Register to read more stories
Continue With:-
Google
Facebook
Email
Already have an account? Sign in",https://indianexpress.com/article/business/market/ipo-launch-this-week-nova-agritech-hit-epack-durables-bse-nse-9122181/,business
Sony sends notice to terminate merger with Zee Entertainment,"Sony Corporation issued a notice terminating the definitive agreements entered into by SPNI and ZEEL relating to the $10 billion merger, which was previously announced on December 22, 2021. While Sony cited the delay in the merger, there were conflicting views about the leadership of the combined entity by Zee’s MD & CEO Punit Goenka.","Japan’s Sony Group Corporation on Monday (January 22) called off the proposal to merge its Indian subsidiary Sony Pictures Networks India Private Ltd (SPNI), now known as Culver Max Entertainment Ltd (CME), with Zee Entertainment Enterprises Ltd (ZEEL).
Sony Corporation issued a notice terminating the definitive agreements entered into by SPNI and ZEEL relating to the $10 billion merger, which was previously announced on December 22, 2021. While Sony cited the delay in the merger, there were conflicting views about the leadership of the combined entity by Zee’s MD & CEO Punit Goenka.
You have exhausted your monthly limit of free stories.
Register to read more stories
Continue With:-
Google
Facebook
Email
Already have an account? Sign in",https://indianexpress.com/article/business/companies/sony-calls-off-merger-with-zee-entertainment-9121362/,business
